Customer Support Agent,SkySlope,💰 $140k - $180k,🌏 Worldwide,2022-02-14T17:25:05+00:00,https://remoteok.com/remote-jobs/108995-remote-customer-support-agent-skyslope,"[""SkySlope \n\n\nApply now\n\n\n👀 903 views\n\n\n✅ 119 applied\n(13%)\n\n\n\nShare this job:\n\n\n\nGet a rok.co short link\n\n\n\nSkySlope is hiring a Remote Customer Support Agent \nOUR ORIGIN STORY 🎂\\nIn 2011 SkySlope started as an idea born at the kitchen table of our CEO, with just him and two others. Headquartered in Sacramento, California, we have since grown out of our previous 3 offices and many of our close to 180 employees are spread all across the United States. Those 180 employees support close to 300,000 users across 5,000 offices nationwide and now in Canada as well. Included in that is 8 out of the 15 largest Real Estate Brokerages in the nation.\\n\\nBut, despite being happy with what we’ve achieved we know that as industry leaders in our space there’s a lot of work left to be done. All of the growth and success that has happened is a result of us obsessing over building cutting edge software that makes the Real Estate world a better place. We know this only happens by hiring people who don’t just come up with out of the box ideas but hiring people who actually see those ideas through and bring them to life. As we’ve grown, we’ve been fortunate enough to hire plenty of people who possess that quality and realize it’s equally important to hire people who can pair that skill with empathy, collaboration, and a keen sense of urgency. If you’re looking to join a company where you can have real impact and surround yourself with an incredible team of people then look no further.\\n\xa0\xa0\xa0\xa0\xa0\xa0\xa0\xa0\xa0\xa0\xa0\xa0\xa0\xa0\xa0\xa0\xa0\xa0\xa0\xa0\xa0\xa0\xa0\xa0\xa0\xa0\xa0\xa0\xa0\xa0\xa0\xa0\xa0\xa0\xa0\xa0\xa0\xa0\xa0\xa0\xa0\xa0\xa0\xa0\xa0\xa0\xa0\xa0\xa0\xa0\xa0\xa0\xa0\xa0\xa0\xa0\xa0\xa0\xa0\xa0\xa0\xa0\xa0\xa0\xa0\xa0\xa0\xa0\xa0\xa0\xa0\xa0\xa0\xa0\xa0\xa0\xa0\xa0\xa0\xa0\xa0\xa0\xa0\xa0\xa0\xa0\xa0\xa0\xa0\xa0\xa0\xa0\xa0\xa0\xa0\xa0\xa0\xa0\xa0\xa0\xa0\xa0\xa0\xa0\xa0\xa0\xa0\xa0\xa0\xa0\xa0\xa0\xa0\xa0\xa0\xa0\xa0\xa0\xa0\xa0\xa0\xa0\xa0\xa0\xa0\xa0\xa0\xa0\xa0\xa0\xa0\xa0\xa0\xa0\xa0\xa0\xa0\xa0\xa0\xa0\xa0\xa0\xa0\xa0\xa0\xa0\xa0\xa0\xa0\xa0\xa0\xa0\xa0\xa0\xa0\xa0\xa0\xa0\xa0\xa0\xa0\xa0\xa0\xa0\xa0\xa0\xa0\xa0\xa0\xa0\xa0\xa0\xa0\xa0\xa0\xa0\xa0\xa0\xa0\xa0\xa0\xa0\xa0\xa0\xa0\xa0\xa0\xa0\xa0\xa0\xa0\xa0\xa0\xa0\xa0\xa0\xa0\xa0\xa0\xa0\xa0\xa0\xa0\xa0\xa0\xa0\xa0\xa0\\n\\nSKYSLOPE’S CORE VALUES 💪🏻\\nThese are the principles that helped us get to where we are and they are the principles that will guide us to where we want to go in the future. You can apply them to your professional life, your personal life, to any business and any situation. In no specific hierarchy, our core values are:\\n\\nAwareness | Execution | Obsession | Ownership | Humility | Radical Candor | Urgency | Greatness | Inches\\n\\nLearn more about our core values from our CEO, Tyler Smith, and our former COO, DJ Stephan here!\\n\xa0\xa0\xa0\xa0\xa0\xa0\xa0\xa0\xa0\xa0\xa0\xa0\xa0\xa0\xa0\xa0\xa0\xa0\xa0\xa0\xa0\xa0\xa0\xa0\xa0\xa0\xa0\xa0\xa0\xa0\xa0\xa0\xa0\xa0\xa0\xa0\xa0\xa0\xa0\xa0\xa0\xa0\xa0\xa0\xa0\xa0\xa0\xa0\xa0\xa0\xa0\xa0\xa0\xa0\xa0\xa0\xa0\xa0\xa0\xa0\xa0\xa0\xa0\xa0\xa0\xa0\xa0\xa0\xa0\xa0\xa0\xa0\xa0\xa0\xa0\xa0\xa0\xa0\xa0\xa0\xa0\xa0\xa0\xa0\xa0\xa0\xa0\xa0\xa0\xa0\xa0\xa0\xa0\xa0\xa0\xa0\xa0\xa0\xa0\xa0\xa0\xa0\xa0\xa0\xa0\xa0\xa0\xa0\xa0\xa0\xa0\xa0\xa0\xa0\xa0\xa0\xa0\xa0\xa0\xa0\xa0\xa0\xa0\xa0\xa0\xa0\xa0\xa0\xa0\xa0\xa0\xa0\xa0\xa0\xa0\xa0\xa0\xa0\xa0\xa0\xa0\xa0\xa0\xa0\xa0\xa0\xa0\xa0\xa0\xa0\xa0\xa0\xa0\xa0\xa0\xa0\xa0\xa0\xa0\xa0\xa0\xa0\xa0\xa0\xa0\xa0\xa0\xa0\xa0\xa0\xa0\xa0\xa0\xa0\xa0\xa0\xa0\xa0\xa0\xa0\xa0\xa0\xa0\xa0\xa0\xa0\xa0\xa0\xa0\xa0\xa0\xa0\xa0\xa0\xa0\xa0\xa0\xa0\xa0\xa0\xa0\xa0\xa0\xa0\xa0\xa0\xa0\xa0\\n\\nTHE JOB 💻\\nSkySlope's Customer Support Representative (CSR) provides exceptional customer, technical, and product support to customers in pursuit of making life better for every real estate agent, broker and service provider. Specifically, this involves responding to customer support tickets and resolving issues, supporting peers in order to increase overall efficiency of the whole department, and maintaining expert level proficiency on the system.\\n\\n\\n\\nWe sincerely thank you for taking the time to review our open positions and hope you'll take the time to submit a concise and thoughtful application. \\n\\nStill thinking about applying? Waiting to hear back from us? Check out our social media in the meantime!\\nSkySlope | Facebook | Instagram | YouTube | LinkedIn | Twitter \\n\\n#Salary and compensation\\n\nNo salary data published by company so we estimated salary based on similar jobs related to Customer Support and Non Tech jobs that are similar:\\n\\n\n$40,000 — $70,000/year\\n\n\\n\\n#Location\\nMust Reside in the US\n\n\n\n\nSee more jobs at SkySlope""]","['customer support', 'non tech']",https://remoteok.com,REMOTEOK
Senior Software Developer,ready2order,💰 $50k - $70k,🌏 Worldwide,2022-02-14T13:55:29+00:00,https://remoteok.com/remote-jobs/108992-remote-senior-software-developer-ready2order,"['ready2order is hiring a Remote Senior Software Developer \nBerlin, Remote, Vienna\\n\\n\\n\\n\\n\\n\\n\\nAbout the role\\n\\nready2order is looking for a Senior Software Developer with PHP/Laravel and Javascript/React skills who will help us build and improve our Electronic Point of Sale products and services on a range of platforms. This is an opportunity to demonstrate your expertise in building high performance systems that scale to meet real-world demands and evaluate lead edge technology. \\n\\nAs a member of our team you will have dedicated time to develop yourself but you will also have the opportunity to grow into a mentoring and coaching role for our more junior developers. Being a senior developer offers the chance to grow into a tech lead for one of our product development teams and take on the direct responsibility for Product technical decisions.\\n\\nThe cross functional team you will work with uses the Scrum Agile Development methodology to promote the rapid development of quality code and enable the use of innovative and emerging technology to create effective products. The role will report to the Head of Engineering.\\n\\n\\nWhat you will do\\n\\n\\n* Own and execute modern UI front-end development with a strong appreciation of established UX design patterns and performance measurements\\n\\n* Writing reusable, testable, and efficient code\\n\\n* Architect solutions using modern front-end stacks focusing on performance and reliability\\n\\n* Build and maintain best practises and guidelines for the wider team\\n\\n* Proactive team player with ability to lead, motivate and inspire others\\n\\n\\n\\n\\n\\nWhat makes you ready for us\\n\\n\\n* Live our core values: Customer-centricity, Teamwork, Ownership, Open Mindedness\\n\\n* We are looking for T-shaped developers with excellent skills in either PHP / Laravel or JavaScript / React.js\\n\\n* Excellent experience building responsive and performance apps designed to run on mobile devices \\n\\n* Strong experience with integrating internal and third-party API end-points and services\\n\\n* Experience with modern CSS approaches and frameworks such as Tailwind or Bootstrap\\n\\n* Familiarity with modern development and build tools such as git, yarn, babel and webpack\\n\\n* Highly solution oriented and analytical\\n\\n* Strong team player, with the ability to work collaboratively with others\\n\\n* Strong verbal and written communication skills\\n\\n* Ideally fintech or payment service background\\n\\n\\n\\n\\n\\n\\nAbout Us\\n\\nready2order is a FinTech company specializing in the development of innovative business management solutions for small businesses. Numerous features such as mobile payment, customer and inventory management, advanced analytics, and an intuitive checkout system help businesses to fully exploit their economic potential. \\n\\nFounded in 2015, ready2order has more than 10.000 customers in Germany and Austria. A team of around 100 people work in a remote-first environment on a centralized platform for all financial needs of small businesses. Our goal is to grow our customer base to more than 100.000 businesses and become the leading financial aggregator in Europe.\\n\\nOur vision is to become the standard for small business management by providing centralized access to all the essential tools that entrepreneurs need to realize the full potential of their business.\\n\\n\\nWhat makes us ready for you\\n\\n\\n* We put trust in our people and their skills by giving them the opportunity to take ownership and have a direct impact on the product and the business\\n\\n* We are a group of open minded team players who help and support each other, also during challenging times\\n\\n* Remote working while still valuing personal relationships is key to us - we provide you with the equipment to work from home as well as great office spaces in Vienna & Berlin\\n\\n* Choose your equipment - are you team Mac or team Windows?\\n\\n\\n\\n\\n\\nThe minimum salary for this position according to collective agreement is EUR 52.220 gross per year. Of course, we are willing to pay a higher salary depending on your qualification and experience. \\n\\nIf that sounds exciting to you, apply to join our team and help us get ready2order to the next level!\\n\\nWe are looking forward to getting to know you!\\n\\nPlease read our Privacy Policy for information on how we process your data. \\n\\n#Salary and compensation\\n\nNo salary data published by company so we estimated salary based on similar jobs related to Developer, Senior and Digital Nomad jobs that are similar:\\n\\n\n$60,000 — $120,000/year\\n\n\n\n\n\nSee more jobs at ready2order']","['dev', 'senior']",https://remoteok.com,REMOTEOK
AI Engineer,Sticker Mule,💰 $33k - $58k*,🇪🇺 EU,2022-02-13T00:00:12+00:00,https://remoteok.com/remote-jobs/107207-remote-ai-engineer-sticker-mule,"['Sticker Mule \n\n\nApply now\n\n\n👀 5,152 views\n\n\n✅ 956 applied\n(19%)\n\n\n\nShare this job:\n\n\n\nGet a rok.co short link\n\n\n\nSticker Mule is also hiring a:\n\n\n\nSoftware engineer \nSales consultant \nDirector of SEO  \n\n\nSticker Mule is hiring a Remote AI Engineer \nSticker Mule is the Internet\'s most ""kick ass"" brand. We are privately-owned, profitable, and powered by a globally distributed team who cares deeply about delivering a great customer experience at the highest technical standards. Our software team operates from 17 countries, and we\'re always looking for more exceptional engineers.\\n\\nThe Machine Learning team is responsible for building and maintaining our ML-assisted tools like [Trace](https://www.stickermule.com/trace) and [Upsacle](https://www.stickermule.com/upscale).\\n\\n[See more about our teams here](https://www.stickermule.com/about)\\n\\nWe offer\\n1. Remote work with flexible schedules\\n2. Varied, interesting technical challenges to solve\\n3. A fun ""no bullshit"" work environment\\n\\nWe like you to know\\n1. Docker\\n2. JavaScript\\n3. Python (numpy, pandas)\\n4. Go\\n5. TensorFlow\\n6. Postgres\\n7. Familiarity with Computer Vision\\n8. Excellent communication skills (English)\\n9. Expertise in computer vision (openCV, keras), NLP (keras) or reinforcement learning\\n\\nChallenges\\n1. Improve our ML-assisted tools\\n2. Train new models for upcoming projects\\n3. Maintain optimal performance at scale\\n\\nCompensation and benefits\\n1. $99k+ based on experience\\n2. $10,000 signing bonus\\n3. 28 days vacation (+ holidays based on your country of residence) \\n\\nBe sure to mention the word **DURABLE** when applying to show you read the job post completely. This is a beta feature to avoid spam applicants. Companies can search these words to find applicants that read this and see they\'re human.\\n\\n \\n\\n#Salary and compensation\\n\n/year\\n\n\\n\\n#Location\\n🌏 Worldwide\n\n\n\n\nSee more jobs at Sticker Mule']","['artificial intelligence', 'engineer']",https://remoteok.com,REMOTEOK
Senior Back End Developer,Toptal,💰 $33k - $58k*,🇪🇺 EU,2022-02-12T01:38:13+00:00,https://remoteok.com/remote-jobs/108935-remote-senior-back-end-developer-toptal,"[""Toptal \n\n\n\ntoptal.com \n\n\nApply now\n\n\n👀 920 views\n\n\n✅ 61 applied\n(7%)\n\n\n\nShare this job:\n\n\n\nGet a rok.co short link\n\n\n\nToptal is also hiring a:\n\n\n\nSenior Front End Developer \nSenior Full Stack Developer \nSenior React Developer \nDigital Product Designer \nSenior React Native Developer  \n\n\nToptal is hiring a Remote Senior Back End Developer \n***Design your full-time freelance career as a top freelance developer with Toptal.***\\n\\nFreelance work is defining developer careers in exciting new ways. If you’re passionate about finding rapid career growth potential working with leading Fortune 500 brands and innovative Silicon Valley startups, Toptal could be a great fit for your next career shift. \\n\\nToptal is an elite talent network made up of the world’s top 3% of developers, connecting the best and brightest freelancers with top organizations. Unlike a 9-to-5 job, you’ll choose your own schedule and work from anywhere.\xa0**Jobs come to you, so you won’t bid for projects against other developers in a race to the bottom.**\xa0Plus, Toptal takes care of all the overhead, empowering you to focus on successful engagements while getting paid on time, at the rate you decide, every time. Our sophisticated screening process makes sure you are provided with top clients without additional overhead, as well as assistance in maximizing the potential of your full-time freelance career. Joining the Toptal network also gives you access to technical training programs, mentors, and coaching programs, so you can connect with a global community of experts like you to share peer-to-peer knowledge and expand your network globally. \\n\\nAs a freelance developer, you can become a part of an ever-expanding community of experts in over 120 countries, working remotely on projects that meet your career ambitions. \\n\\nThat’s why the world’s top 3% of developers choose Toptal. Developers in our network share:\\n* English language proficiency\\n* 3+ years of professional experience in Back End Development\\n* Solid experience in Ruby on Rails or/and Node.js is a strong advantage\\n* Project management skills\\n* A keen attention to detail\\n* Experience with system architecture or leading a software team is a strong advantage\\n* Full-time availability is a strong advantage\\n\\nCurious to know how much you could make? Check out our Back End developer rate calculator: [https://topt.al/dZcA25](https://topt.al/dZcA25)\\n\\nIf you’re interested in pursuing an engaging career working on full-time freelance jobs for exclusive clients, take the next step by clicking apply and filling out the short form: [https://topt.al/wZcXMG](https://topt.al/wZcXMG) \\n\\n#Salary and compensation\\n\n$50,000 — $300,000/year\\n\n\\n\\n#Location\\n🌏 Worldwide\n\n\n\n\nSee more jobs at Toptal\n\n\nVisit Toptal's website""]","['backend', 'senior', 'dev', 'developer']",https://remoteok.com,REMOTEOK
SOC Firmware Engineer,Luxor Technology,💰 $65k - $110k*,🇪🇺 EU,2022-02-12T00:02:23+00:00,https://remoteok.com/remote-jobs/108929-remote-soc-firmware-engineer-luxor-technology,"[""Luxor Technology \n\n\nApply now\n\n\n👀 429 views\n\n\n✅ 15 applied\n(3%)\n\n\n\nShare this job:\n\n\n\nGet a rok.co short link\n\n\n\nLuxor Technology is also hiring a:\n\n\n\nAccounting Analyst  \n\n\nLuxor Technology is hiring a Remote SOC Firmware Engineer \nLuxor specializes in the physical delivery of hashrate (compute power). Over the past four years, we have been acting as a buyer of hashrate, purchasing and mining over $500mm worth. We currently have 140,000 machines that sell us their hashrate daily.\\n\\n**Company Background**\\n\\nWe believe that proof-of-work is the future of decentralized blockchains and we want to help build the underlying infrastructure to support it. We are building a suite of products around compute power as an asset class. Our new venture is custom-firmware for cryptocurrency mining ASICs, a valuable and demanded product in the market.\\n\\nThis role will report directly to the CPO. This position is remote within the US/Canada with the possibility of hybrid depending on location.\\n\\n**Job Requirements**\\n\\n-Experience with Xilinx Zync SOC embedded Linux programming\\n\\n-Experience with creating firmware images using Xilinx Vivado and Petalinux for Xilinx Zynq SOC\\n\\n-Verilog programming experience, especially test benches\\n\\n-Rust programming experience\\n\\n-Reverse engineering experience, especially for the ARM platform used by the Xilinx Zynq SOC\\n\\n-English language proficiency\\n\\n-Bachelors in Engineering or 4 years of relevant experience\\n\\n**Responsibilities**\\n\\n-At the core of this position, you will be building releases of firmwares for an embedded system consisting of some ASICs and a Xilinx SOC.\\n\\n-We do have a working firmware and what we need is an engineer that can take responsibility for building, testing and maintaining the releases.\\n\\n-We also will be adding features to this firmware, so finding and fixing bugs as well as feature additions are another thing you will do.\\n\\n-The firmware will be updatable using a remote GUI. You will work closely with the programmer of this GUI to support and implement this process.\\n\\n\\nAt Luxor we believe that meaningful contributions can be made by anyone. Each of us has a responsibility to drive Equality in our communities and workplaces. We are committed to creating a workforce that reflects society through inclusive programs and initiatives such as equal pay, employee resource groups, inclusive benefits, and more. Luxor is an Equal Employment Opportunity and Affirmative Action Employers. Qualified applicants will receive consideration for employment without regard to race, color, religion, sex, sexual orientation, gender perception or identity, national origin, age, marital status, protected veteran status, or disability status. Luxor welcomes all. Luxor does not accept unsolicited headhunter and agency resumes. Luxor will not pay any third-party agency or company that does not have a signed agreement with Luxor. \\n\\nBe sure to mention the word **FTW** when applying to show you read the job post completely. This is a beta feature to avoid spam applicants. Companies can search these words to find applicants that read this and see they're human.\\n\\n \\n\\n#Salary and compensation\\n\n$140,000 — $180,000/year\\n\n\\n\\n#Location\\nUSA and Canada\n\n\n\n\nSee more jobs at Luxor Technology""]","['rust', 'reverse engineering', 'firmware images', 'verilog']",https://remoteok.com,REMOTEOK
Accounting Analyst,Luxor Technology,💰 $60k - $112k*,🇪🇺 EU,2022-02-11T22:15:14+00:00,https://remoteok.com/remote-jobs/108922-remote-accounting-analyst-luxor-technology,"[""Luxor Technology \n\n\nApply now\n\n\n👀 628 views\n\n\n✅ 61 applied\n(10%)\n\n\n\nShare this job:\n\n\n\nGet a rok.co short link\n\n\n\nLuxor Technology is also hiring a:\n\n\n\nSOC Firmware Engineer  \n\n\nLuxor Technology is hiring a Remote Accounting Analyst \n**Company Background**\\n\\nLuxor specializes in the physical delivery of hashrate (compute power). We have built a suite of software products and services in the crypto mining space.\\n\\nWe fundamentally believe that compute power itself is a commodity and we want to build out traditional marketplaces and derivates for it. We are building a spot-market for hashrate, not dissimilar to a compute-power version of Henry Hub. After this is completed we will begin building incredibly powerful and interesting derivative products on the value of hashrate.\\n\\nThis role will report to our Senior Financial Analyst. This is a remote role. The candidate must be based in the U.S. or Canada with proper work authorization.\\n\\n\\n**Requirements:**\\n\\n-Bachelor’s degree in accounting or finance.\\n-CPA or CFA\\n-Minimum 3 years' experience in accounting/finance.\\n-Experience in working with multiple legal entities under different legal umbrellas.\\n-Experience with financial reporting requirements in the U.S.\\n-Knowledge and expertise in cryptocurrency tax and regulation in the U.S.\\n-Experience with cryptocurrency wallets and transacting via Blockchains.\\n-Working knowledge of SQL.\\n-Programming experience, Python preferred.\\n-Knowledge of the crypto mining industry, including the technology and economics.\\n\\n\\n**Responsibilities:**\\n\\n-Preparing financial reports for internal and external use.\\n-Perform daily general ledger accounting, financial reporting, and analysis.\\n-Filing taxes in coordination with our third-party CPA firm.\\n-Ready to work on a wide range of operational tasks.\\n\\n\\nAt Luxor we believe that meaningful contributions can be made by anyone. Each of us has a responsibility to drive Equality in our communities and workplaces. We are committed to creating a workforce that reflects society through inclusive programs and initiatives such as equal pay, employee resource groups, inclusive benefits, and more. Luxor is an Equal Employment Opportunity and Affirmative Action Employers. Qualified applicants will receive consideration for employment without regard to race, color, religion, sex, sexual orientation, gender perception or identity, national origin, age, marital status, protected veteran status, or disability status. Luxor welcomes all. Luxor does not accept unsolicited headhunter and agency resumes. Luxor will not pay any third-party agency or company that does not have a signed agreement with Luxor. \\n\\nBe sure to mention the word **ALTRUISTICALLY** when applying to show you read the job post completely. This is a beta feature to avoid spam applicants. Companies can search these words to find applicants that read this and see they're human.\\n\\n \\n\\n#Salary and compensation\\n\n$50,000 — $70,000/year\\n\n\\n\\n#Location\\nUSA and Canada\n\n\n\n\nSee more jobs at Luxor Technology""]","['crypto', 'accounting', 'finance', 'web3']",https://remoteok.com,REMOTEOK
