Posicion,Empresa,Salario,Ubicacion,Fecha de publicacion,URL de la vacante,Descripción,skills,Home URL,Nombre del Sitio
Backend & Infrastructure Engineer,Coinflow,💰 $50k - $80k,🌏 Worldwide,2022-02-14T15:44:08+00:00,https://remoteok.com/remote-jobs/108994-remote-backend-infrastructure-engineer-coinflow,"[""Coinflow \n\n\n\ncoinflow.com \n\n\nApply now\n\n\n👀 682 views\n\n\n✅ 70 applied\n(10%)\n\n\n\nShare this job:\n\n\n\n\n\n\n\nCoinflow is hiring a Remote Backend & Infrastructure Engineer \n## Company Summary\\nAt Coinflow, our goal is to make crypto payment smooth, secure, and scalable. To do so, we are building a crypto payment processor that can handle hundreds and millions of transactions on a daily basis. \\n\\nWe are an internal initiative started from an established corporation. Our primary goal is to support our parent company in handling crypto payments. We are a small, committed, and independent team that is rapidly growing. \\n\\nIf you share our vision and want to be part of the transforming force for the payment scene, come and join us!\\n \\n## Job Summary\\nYou will be responsible for successful execution and delivery of technical aspects of enterprise-level projects, either individually or as part of the development team. You will work closely with the Product Manager to ensure Coinflow’s technological developments and operational components are delivered on time and to specifications. You will be leading the technical development of the software, managing the infrastructure, and working with other developer(s) to deliver features. \\n \\n## Tech Stack\\n* Backend: Java/Spring/Maven\\n* Database: PostgreSQL, Redis\\n* Hosting: AWS EC2, S3, RDS, and Fargate\\n \\n## Key Responsibilities\\n* Interact with business and technical stakeholders to understand requirements, challenges and expectations\\n* Ensure quality of deliverables to the satisfaction of the customer and end user expectation\\n* Collaborate with the product team to implement robust, high performance, data-driven web applications\\n* Design, build, and maintain the core infrastructure with a focus on extensibility and scalability\\n* Provide insight into modernizing legacy platforms to the latest and greatest technologies\\n* Solve complex problems with innovative and elegant design and delivery\\n* Integrate third party technology into Coiniflow’s tech stack, or vice versa\\n* Enforce coding standards and set a high standard for code quality\\n \\n## Skills and Qualifications\\n* At least 3 years of demonstrable experience with backend development\\n* Expert knowledge of Java\\n* Experienced with AWS, as well as general DevOps and DBA responsibilities\\n* Excellent organizational skills and attention to detail\\n* Ability to work independently and remotely while maintaining open lines of communication with others across the organization\\n* Ability to accept feedback and constructive criticism positively\\n* Full professional proficiency of English language skills\\n* Inspired by the startup environment where a sense of initiative is key\\n* Bonus point if you have worked on crypto projects before \\n\\n## Benefits\\n* 100% remote working\\n* Flexible working hours\\n* Paid time off\\n* Autonomy to build technical solutions without micro-management\\n* Small enough that you can have an impact with your code\\n* Backed by established company so you have enough job security \\n\\nBe sure to mention the word **PLEASED** when applying to show you read the job post completely. This is a beta feature to avoid spam applicants. Companies can search these words to find applicants that read this and see they're human.\\n\\n \\n\\n#Salary and compensation\\n\n$50,000 — $80,000/year\\n\n\\n\\n#Location\\n🌏 Worldwide\n\n\n\n\nSee more jobs at Coinflow\n\n\nVisit Coinflow's website""]","['java', 'infra', 'backend', 'engineer']",https://remoteok.com,REMOTEOK
Product Growth Manager Activation,Vimeo,💰 $63k - $103k*,"New York City, New York, United States",2022-02-11T10:45:57+00:00,https://remoteok.com/remote-jobs/108452-remote-product-growth-manager-activation-vimeo,"['Vimeo \n\n\nApply now\n\n\n👀 9,723 views\n\n\n✅ 589 applied\n(6%)\n\n\n\nShare this job:\n\n\n\n\n\n\n\nVimeo is hiring a Remote Product Growth Manager Activation \n\\nAt Vimeo, we believe that more meaningfully than the work that you do, it’s the people that you accomplish it with. Our core values are very important to us, one of which being ‘nothing is sacred’. On the Growth team, we take this very seriously, and we use this principle to unlock our experimentation prowess from anything inside the product experience, all the way up the funnel to the pricing and check-out pages on Vimeo.com. We’ve already built an extraordinary team full of engineers, analysts, and designers for our desktop web world, and we need the right next leader to take the torch and help us scale experimentation and full-funnel optimization, starting with new-user onboarding and unlocking value as quickly as possible!\\n\\n\\nTo that end, Vimeo is looking for an ambitious Product Manager, Growth to help break down barriers and help push our team to greater heights with data literacy and UX storytelling. Vimeo Growth sits at the convergence of product, marketing, and data, digging through data to find the needle in the haystack and obsessing about user experiences, balancing what’s right for the business and fighting for what’s best for the user. Historically the team has been lean, but we’re at a pivotal stage in our journey where we need to scale for rapid experimentation velocity. We are looking for that outstanding leader with the hunger to build a fast, forward-thinking, high-impact process from the ground up with a ready & willing team by their side. Could you be the next growth leader here?\\n\\n\\nWhat you’ll do:\\n\\n\\n\\n\\nDefine and drive the activation strategy to unlock user engagement and subscription growth from our growing base of millions of new and existing users that come into our flagship experience.\\n\\n\\nDevelop a deep understanding of our users to help identify the right persona and lifecycle segmentation needed to nudge users into the next best actions for them.\\n\\n\\nIdentify and own key activation pathways, crafting repeatable and scalable frameworks and components to enable targeting users with the right information at the right time.\\n\\n\\nLead experimentation process around collecting more user information about a user to generate a robust profile that will allow the team to drive key actions and unlock value.\\n\\n\\nDrive cross functional activation strategy across growth, CRM, paid marketing and core product teams.\\n\\n\\nPartner with various product teams to ensure new products and existing products have the appropriate on ramps needed to be able to activate users into key features.\\n\\n\\nChampion and balance user needs with revenue metrics through innovative and robust experimentation\\n\\n\\nHelp hire, build, and scale the Activation Growth team in partnership with the leadership team.\\n\\n\\n\\n\\n\\n\\nSkills and knowledge you should possess:\\n\\n\\n\\n\\n3+ years in a growth or product role\\n\\n\\n2+ years experience driving product-led growth and experimentation methodologies.\\n\\n\\nBachelor’s degree\\n\\n\\nExperience leading a cross-functional team, and driving strong engineering partnership\\n\\n\\nExperience developing in-product and out-of-product experiences\\n\\n\\nProven track record in using data to drive product and/or business decisions\\n\\n\\nConsistent impact on the business on top level metrics\\n\\n\\nAbility to encourage, empower, and lead teams to shoot for the moon\\n\\n\\nStrong foundational understanding of A/B testing methodologies and impact measurement\\n\\n\\nAn extraordinary sense of humor and the ability to roll with the punches (your team leader will have a bunch of bad dad jokes)\\n\\n\\n\\n\\n\\n#LI-JS1 \\n\\n#Salary and compensation\\n\nNo salary data published by company so we estimated salary based on similar jobs related to Product Management, Project Management, Product, Marketing, Executive and Growth jobs that are similar:\\n\\n\n$62,500 — $102,500/year\\n\n\\n\\n#Location\\nNew York City, New York, United States\n\n\n\n\nSee more jobs at Vimeo']","['product management', 'project management', 'pm', 'product']",https://remoteok.com,REMOTEOK
Ruby on Rails Developer,QContact,💰 $40k - $80k,🇪🇺 EU,2022-02-10T11:19:30+00:00,https://remoteok.com/remote-jobs/108552-remote-ruby-on-rails-developer-qcontact,"[""QContact \n\n\n\nqcontact.com \n\n\nApply now\n\n\n👀 4,900 views\n\n\n✅ 278 applied\n(6%)\n\n\n\nShare this job:\n\n\n\n\n\n\n\nQContact is hiring a Remote Ruby on Rails Developer \nQContact is a rapidly growing and profitable provider of software which allows businesses to take control of their communications. Whether customers wish to call, text, e-mail, live chat, tweet - we provide a single interface to manage every conversation as well as providing ticketing, CRM and more. With users as far East as the US and as far West as Australia - we help businesses across the world meet all their CRM & Communication needs. \\n\\nQContact has always been a remote-first company, and our development team is spread across Europe. We are now looking for another back end engineer to join the team. If you want to big a tiny cog in a big machine, we're not the right business for you. If you want a very high level of autonomy, with the ability to make your own decisions - this is the role for you. \\n\\n* You should have at least two years experience with Ruby on Rails\\n* You should have a good understanding of SQL and how to write efficient queries\\n* Experience with Elasticsearch a benefit\\n* You must be fluent in English\\n* You must reside within in the European Union or United Kingdom\\n* Great career prospects - we are growing rapidly and always look to promote from within.\\n* 20 days paid time-off plus national holidays in your home country\\n* Paid Paternal / Maternity / Adopotion Leave\\n* Flexible working time\\n\\nWe are an equal opportunities employer - we welcome and encourage applications from all backgrounds. \\n\\nBe sure to mention the word **APPRECIABLE** when applying to show you read the job post completely. This is a beta feature to avoid spam applicants. Companies can search these words to find applicants that read this and see they're human.\\n\\n \\n\\n#Salary and compensation\\n\n$40,000 — $80,000/year\\n\n\\n\\n#Location\\n🇪🇺 EU\n\n\n\n\nSee more jobs at QContact\n\n\nVisit QContact's website""]","['ruby', 'telecoms', 'dev', 'ruby']",https://remoteok.com,REMOTEOK
Senior Backend Engineer Portals,WeTransfer,💰 $65k - $120k*,New York,2022-02-08T14:48:40+00:00,https://remoteok.com/remote-jobs/108592-remote-senior-backend-engineer-portals-wetransfer,"['WeTransfer \n\n\nApply now\n\n\n👀 4,821 views\n\n\n✅ 442 applied\n(9%)\n\n\n\nShare this job:\n\n\n\nGet a rok.co short link\n\n\n\nWeTransfer is hiring a Remote Senior Backend Engineer Portals \nEvery day, millions of people rely on WeTransfer to share their creative ideas.\\n\\nHaving made its name in the game of quick and simple file-sharing,\xa0WeTransfer\xa0has grown into an end-to-end suite of digital solutions with more than\xa087 million monthly active users in 190 countries. Beyond the\xa0WeTransfer.com\xa0platform, we have the storytelling platform\xa0WePresent, quick slide-making tool\xa0Paste, immersive sketching app\xa0Paper, and inspiration-capturing tool\xa0Collect. We design and deliver delightful experiences that continue to feel obvious and intuitive to millions of people—from our moms to your favorite artists. As a certified\xa0B-Corp, WeTransfer aims to be a sustainable and responsible tech company, balancing people, planet, and profit\\n\\nSo, the work we do matters.\xa0Come and be a part of it.\\n\\nAbout Portals\\n\\nJoin product and design leaders in developing the vision for the future of WeTransfer’s namesake—internally known as the Portals and Reviews product.\\n\\nThe Portals team is responsible for building and launching WeTransfer’s latest product offering Portals and Reviews (wetransfer.com/portals-reviews) which helps our customers organize projects and clients so they can get sign-off and approval in the simplest and easiest way possible. You will be joining the team at a really exciting stage of this product\'s lifecycle. You will have true ownership and input into Portals and Reviews features and technical direction. This product is a key part of our new WeTransfer premium offering and is leading the way to the next evolution of our service.\\n\\nYou’ll have the opportunity to help shape our engineering and product strategy at a critical phase, laying down the foundation for our next chapter of growth. We’re looking for someone with a rare combination of skills, an appreciation for design, and a passion for building high quality products.\\n\\nYou will be part of a multidisciplinary team, which includes product managers, designers and both frontend and backend developers. Our teams are open, eager to try new things, fun and dynamic. The goal of our team is to collaborate with teams across the company to create the future of WeTransfer that stays true to our mantra ""beautifully obvious"".\\n\\nAbove all else, we value kindness, understanding and empathy. We believe in open and honest communication and good teamwork to achieve a shared vision. We are passionate learners, who aren\'t afraid of trying out new tools and technologies to build a great end-to-end customer experience. We love to share our knowledge and experience when we can.\\n\\nWe strive to maintain a culture of kindness and inclusivity. Our team represents a variety of cultural backgrounds—open and clear communication is a priority. We believe diversity of perspective and experience are key to building great products. You’ll play a key role in fostering collaboration and creating an environment where people can do their best work.\\n\\nAbout the role:\\n\\nYou\'ll be responsible for the happiness of millions of users by implementing new features with your project team as well as ensuring our codebase stays nice and shiny. You will do this in a multidisciplinary team with passionate engineers and designers to deploy features to our users.\\n\\nWeTransfer is an equal opportunity employer and we pride ourselves on the diversity of our people. We welcome you, and everything that makes you—well, you. That includes your gender identity, sexual orientation, religion, ethnicity, age, or disability status.\\n\\nA note on remote\\nCovid has changed the world. Just as much as it changed us. While we can\'t wait until offices re-open, being at the office will not be mandatory in the future. This way, you get the best from both worlds. That move is still pretty new for us though, we are getting there, we are writing more, doing more async communication, and are now ready to take it to the next level. \\n\\nWhile it is not necessarily a determining or disqualifying factor for any role, you may be required to complete a standard employment background screening. \\n\\n#Salary and compensation\\n\nNo salary data published by company so we estimated salary based on similar jobs related to Senior, Engineer and Backend jobs that are similar:\\n\\n\n$65,000 — $120,000/year\\n\n\\n\\n#Location\\nNew York\n\n\n\n\nSee more jobs at WeTransfer']","['senior', 'engineer', 'backend']",https://remoteok.com,REMOTEOK
Copy Editor,Vox,💰 $40k - $60k*,"New York City, New York, United States",2022-02-06T19:12:36+00:00,https://remoteok.com/remote-jobs/108383-remote-copy-editor-vox,"[""Vox \n\n\nApply now\n\n\n👀 22,220 views\n\n\n✅ 3,458 applied\n(16%)\n\n\n\nShare this job:\n\n\n\n\n\n\n\nVox is hiring a Remote Copy Editor \n\\nAs the leading independent modern media company, Vox Media ignites conversations and influences culture. Across digital, podcasts, TV, streaming, live events, and print, we tell stories that affect our audience's daily lives and entertain as much as they inform.\\n\\nOur portfolio features influential and respected editorial properties including Vox, New York Magazine, The Verge, The Cut, Eater, Vulture, The Strategist, Polygon, SB Nation, Intelligencer, Curbed, Grub Street, and Recode. Off-platform, the Vox Media Podcast Network offers one of the largest collections of popular podcasts, and Vox Media Studios produces and distributes the award-winning nonfiction shows. Powered by innovative technology that scales quality, the Chorus publishing platform and Concert advertising marketplace answer the always-changing needs of modern audiences, creators and marketers.\\n\\nVox Media has been named one of Fast Company’s “Most Innovative Companies in Media,” an Inc. “Company of the Year,” Digiday’s “Best Company for Parents,” and one of the Best Places to Work for LGBTQ Equality by the Human Rights Campaign.\\n\\nAbout the position:\\n\\nThe Copy Editor will help maintain and improve the quality of Polygon’s copy across all its coverage. They will copy edit every type of editorial content, from short news stories to long-form features, and will be instrumental in being the final pass on Polygon’s work. They will collaborate with every editorial desk at Polygon, and ideally will have an interest in video games, entertainment, and internet culture.\\n\\nWhat you’ll do:\\n\\n\\nCopy edit stories that appear on Polygon, ensuring that they have proper spelling, grammar, punctuation, and diction, and that they adhere to our internal style guidelines. These stories can come from across Polygon’s various editorial teams, and include news, features, reviews, and sponsored editorial content.\\n\\nIdentify grammar and style issues as they arise both on- and off-platform, and ensure that guidelines and expectations are clearly communicated to writers.\\n\\nAct as a point of reference for any style or grammar inquiries from the staff.\\n\\nCollaborate with editors to update and maintain Polygon’s comprehensive internal style guide and associated resources.\\n\\nRemain up to speed on current language/industry trends as they pertain to Polygon’s voice, particularly with respect to diversity, equity, and inclusion.\\n\\n\\n\\n\\nWhat you’ll bring:\\n\\n\\nAt least one to two years of copy editing experience\\n\\nClose familiarity with AP style\\n\\nStrong interpersonal skills\\n\\nFamiliarity with video games, movies, TV shows, comics, and internet culture is a plus\\n\\n\\n\\n\\n*This role is a part of the Vox Media Union, represented by the Writers Guild of America, East.\\n\\nAbout working at Vox Media:\\n\\nThis is a permanent, full-time position with excellent benefits—including flexible hours and generous parental leave. Vox Media strives to provide comprehensive healthcare options for our employees and to ensure that our healthcare and other benefits are LGBTQ-inclusive. You'll be joining a group of focused, hard-working, creative people who are passionate about doing work that's challenging and fun—and who strive to maintain a healthy work/life balance.\\nVox Media is committed to building an inclusive environment for people of all backgrounds and everyone is encouraged to apply. Vox Media is an Equal Opportunity Employer and does not discriminate on the basis of race, color, gender, sexual orientation, gender identity or expression, religion, disability, national origin, protected veteran status, age, or any other status protected by applicable national, federal, state, or local law.\\nVox Media is dedicated to the health and wellbeing of all of our employees. All employees in our offices are required to be fully vaccinated against COVID-19, unless they have an approved religious or medical exemption. Employees with approved religious or medical exemptions may be subject to additional safety requirements, including submitting to regular COVID-19 testing and wearing a face covering in our offices.\xa0\\n\\nPlease note that our recruiting team will only contact you from @voxmedia.com\xa0email addresses, and we will never contact you via text message. \\n\\n#Salary and compensation\\n\nNo salary data published by company so we estimated salary based on similar jobs related to Writing, Copywriting, Editing and Non Tech jobs that are similar:\\n\\n\n$40,000 — $60,000/year\\n\n\\n\\n#Location\\nNew York City, New York, United States\n\n\n\n\nSee more jobs at Vox""]","['writing', 'copywriting', 'editor', 'editing']",https://remoteok.com,REMOTEOK
Product Design Summer 2022 Internship,Tile,💰 $60k - $125k*,US - Remote,2022-02-04T10:34:10+00:00,https://remoteok.com/remote-jobs/108535-remote-product-design-summer-2022-internship-tile,"['Tile \n\n\nApply now\n\n\n👀 8,470 views\n\n\n✅ 1,174 applied\n(14%)\n\n\n\nShare this job:\n\n\n\n\n\n\n\nTile is hiring a Remote Product Design Summer 2022 Internship \nWe’re looking for open-minded individuals who want to expand the ways technology can help people. We work fast, collaborate, and celebrate as a team. We’re united by a commitment to shaping Tile’s culture around the needs of our colleagues and customers, and by our desire to build a diverse and welcoming workplace.\\n\\nThis program is designed to help junior designers truly own their craft by getting real hands on experience with Product Design. We will give designers a mentor to help guide them along the way, a sandbox where they can learn a make mistakes, and real project experience that could potentially get on the roadmap.\xa0\\n\\nAt the conclusion of the internship, the designer will have all the tools to become functional Product Designer.\\n\\nTile has a Mandatory COVID-19 Vaccination Policy that applies to all employees that work on-site at our San Mateo office.\xa0\xa0 Employees not working remotely will have to upload their vaccination records via a secure link within the first week of their employment.\\n\\nWe are an equal opportunity employer and value diversity at our company. We do not discriminate on the basis of race, religion, color, national origin, gender, sexual orientation, age, marital status, veteran status, or disability status. \\n\\n#Salary and compensation\\n\nNo salary data published by company so we estimated salary based on similar jobs related to Design, Internship, Junior, UX, UI and Digital Nomad jobs that are similar:\\n\\n\n$60,000 — $125,000/year\\n\n\\n\\n#Location\\nUS - Remote\n\n\n\n\nSee more jobs at Tile']","['design', 'internship', 'junior', 'ux']",https://remoteok.com,REMOTEOK
Senior API Engineer,Colabra,💰 $80k - $140k,🌏 Worldwide,2022-01-30T16:38:30+00:00,https://remoteok.com/remote-jobs/108459-remote-senior-api-engineer-colabra,"[""Colabra \n\n\n\ncolabra.app \n\n\nApply now\n\n\n👀 10,165 views\n\n\n✅ 643 applied\n(6%)\n\n\n\nShare this job:\n\n\n\nGet a rok.co short link\n\n\n\nColabra is hiring a Remote Senior API Engineer \n[Colabra](https://www.colabra.app/)'s mission is to increase the world's scientific output.\\n\\nWe're backed by top investors including Village Global, Builders, Inovia, Jude Gomila, the Technical Director of OpenAI, and founders of several biotech startups.\\n\\nWe're now hiring a senior engineer with experience working on B2B public-facing APIs and [integration](https://www.colabra.app/integrations/) platforms to help us make our product extensible, and ready for enterprise clients.\\n\\n### About us\\n* We’re a small team optimising for impact — not headcount.\\n* We’re using a single programming language — TypeScript (but can review for this project, based on your input).\\n\\n### Responsibilities\\n* Work closely with the founders to develop the platform product vision and strategy.\\n* Design and drive the development of Colabra's public API, related developer-facing products (e.g. CLI), and the broader platform surrounding it.\\n* Work with the engineering team to change application architecture and infrastructure to support this project.\\n\\n### Requirements\\n* 4+ years of API/platform architecture and engineering experience at high-growth B2B startups, and experience working in a remote-first team.\\n* Deep understanding of software design, product and business considerations that go into delivering great public APIs.\\n* Strong experience with modern technology stacks (learning on the job is perfectly fine).\\n* Relentless resourcefulness, ownership mindset, and a proven record of single-handedly taking ideas from conception to live.\\n* Passion for the promotion of science, and experience working on B2B SaaS a plus.\\n\\n### What’s in it for you?\\n* 🧪 Opportunity for outsized impact, working to accelerate world-changing scientific research.\\n* 🌏 Work in an async, remote-first startup where work-life balance is celebrated and promoted.\\n* 🏢 Co-working, ☕️ Coffee, 🧹 Cleaning, 📚 Books and 🏃\u200d♀️ Fitness allowance.\\n* 🌄 Unlimited PTO. \\n\\nBe sure to mention the word **AFFINITY** when applying to show you read the job post completely. This is a beta feature to avoid spam applicants. Companies can search these words to find applicants that read this and see they're human.\\n\\n \\n\\n#Salary and compensation\\n\n$80,000 — $140,000/year\\n\n\\n\\n#Location\\n🌏 Worldwide\n\n\n\n\nSee more jobs at Colabra\n\n\nVisit Colabra's website""]","['api', 'dev', 'platform', 'senior']",https://remoteok.com,REMOTEOK
