Director Product Design,Roostify,💰 $55k - $85k*,Paris,2022-02-12T14:30:06+00:00,https://remoteok.com/remote-jobs/108946-remote-director-product-design-roostify,"['Roostify is hiring a Remote Director Product Design \nWho We Are\\n\\nRoostify is transforming the mortgage industry with an innovative and integrated platform that’s streamlining the entire digital lending experience. We believe that home lending should be a fair, fast, and transparent experience. Our software is used by banks across the country to improve lending experiences every day. We are a team of innovative thinkers on a mission to reinvent the lending experiences so people can accelerate their future.\xa0\xa0\\nChallenges You Will Solve\\n\\nAs the Director of Product Design here at Roostify, you will be in charge of growing and leading our product design team. You will drive the design practice internally, influence the product strategy for our full suite of products, and support the product execution and quality. You will be responsible for guiding your team throughout the design process, ensuring their output is top-notch.\xa0\\n\\nYou will provide design mentorship and be a champion for both craft and career development. You will oversee and build a team of very strong designers. You will create an environment for growth and efficiency by providing organization cover for your team to help the designers execute their best work.\\n\\nYou have a strong eye for design and detail, and you are comfortable in a fast-paced and dynamic environment. You will need to see and plan ten steps ahead. You are essentially a strategist who brings work to life through design. You are hands on and will continue feeding the product and engineering teams with clear designs that achieve the targeted business goals.\\n\\nYou have experience leading and building teams with a track record of delivering business impact and delivering clear experiences through distinct user journeys. You are a proven leader and excellent communicator and never shy away from a challenge. You are comfortable working closely with agencies, product managers, engineers, marketers, and executives.\\nWhat You’ll Do\\n\\n\\nEstablish and grow a strong design culture, provide leadership, and ensure your team success\\n\\nManage a team of designers and design managers, provide design and push the quality of the work\\n\\nInfluence product strategy for a true future state vision and lead your team in executing design work with a high level of polish\\n\\nSolve a range of problems such as loosely defined product ideas or differences of opinions across your team and partners\\n\\nThrive in a fast-paced environment by remaining focused on the most important work to be done\\n\\nHire and retain top talent, focusing on attracting designers from various backgrounds and perspectives\\n\\nImplore user-centric design to create meaningful user journeys\\n\\nWork across the organization with engineering, product, marketing and other key stakeholders\\n\\nOwn the design work for the entire product suite\\n\\nDefine objectives and key results with the team, monitor progress, eliminate roadblocks, and prevent distractions\\n\\n\\n\\nWhat You’ll Bring\\n\\n\\nExtensive experience as a Designer and 5+ years experience growing and leading design teams\xa0\\n\\nProven background in building a high performing team of designers\\n\\nAn independent work mindset, needing limited guidance and direction\\n\\nAbility to think big and understand how to drive action and results\\n\\nA strong process for building product experiences\\n\\nAbility to give clear and actionable feedback to unblock your teams and move the work forward\\n\\nThe knowledge of how to have tough conversations with your design team when things are not going right\\n\\nA data-informed and growth mindset\\n\\nAbility to manage a budget including allocated resources and planning for future hiring needs\\n\\nAbility to thrive in a fast-paced, dynamic startup environment\\n\\nProven ability to solve complex UX problems and product strategy skills to deliver the best visual design solution\\n\\nExperience leading cross-functional design teams with various crafts\\n\\nStaying open to learn and evolve in all things. From leadership skills to design craft to process to industry and market trends — you never stop pushing into the next big challenge.\\n\\n\\n\\nBENEFITS & PERKS\\n\\nAt Roostify we know that people do their best when they feel their best; we care about our people and want them to thrive. Here are some of the benefits we’re proud to offer:\\n\\n\\n* Competitive Salary & Equity Packages\\n\\n* Health, Dental, and Vision Plans\\n\\n* 401K\xa0\\n\\n* Flexible Vacation Time\\n\\n* Bonus Program\\n\\n\\n\\n\\nRoostify is an Equal Opportunity Employer\xa0\\n\\nAt Roostify we have a value of People First. We strive to provide the best experiences to our employees and candidates. We consider applicants without regards to race, color, national origin, sex, age, religion, sexual orientation, gender identity, veteran status, marital status, physical or mental disability, or other protected classes under all local, state, and federal laws and ordinances. Pursuant to the San Francisco Fair Chance Ordinance, we will consider for employment qualified applicants with arrest and conviction records. \\n\\n#Salary and compensation\\n\nNo salary data published by company so we estimated salary based on similar jobs related to Design, Executive and Digital Nomad jobs that are similar:\\n\\n\n$60,000 — $120,000/year\\n\n\\n\\n#Location\\nAustin, Texas, United States\n\n\n\n\nSee more jobs at Roostify']","['design', 'exec']",https://remoteok.com,REMOTEOK
Senior Product Manager Astrology App,Ruby Labs,💰 $65k - $100k*,San Francisco Bay Area,2022-02-12T14:00:02+00:00,https://remoteok.com/remote-jobs/108945-remote-senior-product-manager-astrology-app-ruby-labs,"[""Ruby Labs is hiring a Remote Senior Product Manager Astrology App \nRuby Labs is a leading tech company that operates subscription-based consumer products in the self-help and wellness market.\xa0\\n\\nOur common vision is to create a tech company that builds a world-class self-help and wellness platform, to empower people to make self-care a way of life. A platform that is easily accessible for everyone and enjoyed for years. Since our launch, we've brought two successful products to the global market: Able and Hint, and are on track to launch a third in 2022.\\n\\nThe Opportunity\\n\\nWe are looking for a highly experienced, deeply empathetic Senior Product Manager to join the Hint Product team. We have significant expansion plans, and our ability to deliver delightful, impactful, and exceptional product experiences will be paramount to our continued success.\\n\\nWe’re looking for someone bright, unwaveringly candid, and driven. If you’re a highly ambitious, personable problem-solver, then this is an opportunity to join a fast-growth and ambitious start-up.\\n\\n\\n\\n\\nThe Team\\nYou will be joining a strong team of >100 people passionate about building the best-in-class product. RL has incredible team members, users, and ambitions... which is where you come in.\\n\\nWe are a remote-first company, and our team is distributed across the UK and Europe. This was a deliberate choice to prioritise work-life balance and ensure we can accommodate the best people whilst fostering diversity.\\n\\nOur Values\\nRuby Labs is founded on values we all share and are ready to stand for. They bring us together well beyond our current products and technologies. \\n\\n#Driven by data\\nWe believe in knowledge and continuously champion learning and experimentation. As we are relentlessly driven by data, we place value on rationality and real insights, not unproven beliefs.\\n\\n#Innovation\\nWe praise smart innovation. We’re inquisitive, exact and always challenge our beliefs. Like a researcher, we take established knowledge and add something new. We create something better than the original, not just different.\\n\\n#Dream big\\nIn an industry where only the best products succeed, prioritizing our work is a must. We don’t waste time on low-key projects. We only go after the most disruptive, effective and exceptional ideas.\\n\\n#Transparency\\nTo get the best results, you need to see the full picture. That’s why our team has access to all information and is involved in key decisions. We also give each other honest feedback, so we can learn and improve.\\n\\n#Excellence\\nSelf-help & wellness is a competitive industry with demanding users. Excellence is a necessity. At Ruby Labs, this means solving problems by breaking the rules, learning quickly and delivering superior execution.\\n\\n#Open-mindedness\\nWe’re open to experiments and ready to take measured risks to get great results. We also value diversity and know the power of collective intelligence. If you have a better solution, we want to hear it.\\n\\nEmployment\xa0\\nRegular employment in UK or Malta or Contractor agreement for the team members distributed across Europe (non-UK/Malta).\\n\\n#LI-Remote \\n\\n#Salary and compensation\\n\nNo salary data published by company so we estimated salary based on similar jobs related to Executive and Senior jobs that are similar:\\n\\n\n$67,500 — $110,000/year\\n\n\\n\\n#Location\\nNew York, US\n\n\n\n\nSee more jobs at Ruby Labs""]","['exec', 'senior']",https://remoteok.com,REMOTEOK
Director of People,Anduin,💰 $70k - $120k*,"Boulder, Colorado, United States",2022-02-12T13:00:02+00:00,https://remoteok.com/remote-jobs/108944-remote-director-of-people-anduin,"[""Anduin is hiring a Remote Director of People \nThank you for your interest in joining our “A-Team” at Anduin!\xa0\\n\\nThe big-picture value proposition of this role is simple: join us, and you'll be paid competitively to have freedom in solving worthwhile, challenging problems alongside other A-players at a fast-growing SaaS startup led by an experienced and successful co-founding team with industry experience.\xa0\xa0\\n\\nWhy Anduin?\\n\\nAt Anduin, our values say it all: Courage, Build, and Trust. We take calculated risks, dissent when we disagree and listen to dissenting opinions, know that transparency is imperative to success, and we strive together to build a quality product that no one else in the industry has been able to achieve before.\xa0\\n\\nOther benefits include:\\n• Remote, work-from-anywhere culture\\n• Competitive compensation, healthcare benefits, and stock options\\n• 401(k) matching\\n• Unlimited paid time off\xa0\xa0\\n\\nCheck out our About webpage to learn more about our team, platform origin story, and company values. You can also learn about our recent funding announcement and the latest product news on our Blog.\\n \\n\\n#Salary and compensation\\n\nNo salary data published by company so we estimated salary based on similar jobs related to Executive and Executive jobs that are similar:\\n\\n\n$70,000 — $100,000/year\\n\n\\n\\n#Location\\nVirtual / Anywhere\n\n\n\n\nSee more jobs at Anduin""]",['exec'],https://remoteok.com,REMOTEOK
Content Developer,Zeplin,💰 $70k - $100k*,Anywhere,2022-02-12T12:45:08+00:00,https://remoteok.com/remote-jobs/108943-remote-content-developer-zeplin,"[""Zeplin \n\n\nApply now\n\n\n👀 514 views\n\n\n✅ 17 applied\n(3%)\n\n\n\nShare this job:\n\n\n\nGet a rok.co short link\n\n\n\nZeplin is hiring a Remote Content Developer \nAbout the Role\\nAs a Content Strategist at Zeplin, you will have the opportunity to experiment with creating new types of content for a tech-savvy, creative audience and work closely with the Director of Content Marketing in shaping Zeplin’s overall content marketing strategy and editorial calendar. You will play a direct role in growing Zeplin’s presence as a subject matter expert in the emerging field of DesignOps.\\n\xa0\\nResponsibilities\\n\\n* Drive growth and engagement with users by creating compelling content through website, blog, white papers, emails and more\\n\\n* Work cross functionally with Product Marketing, Growth, Community, and Design on content ideation & planning\\n\\n* Manage blog calendar & content performance metrics\\n\\n* Provide ad-hoc copyediting services, ensuring copy is on-message, informative, engaging, audience appropriate and strategically delivered\\n\\n* Be the steward of Zeplin's external voice and tone\\n\\n* Work closely with Zepliners to thoroughly understand and communicate our core value proposition\\n\\n\\n\\n\xa0\\nRequirements\\n\\n* Ability to rapidly produce concise, crisp, and friendly copy\xa0\\n\\n* Proven experience in B2B SaaS products and creating multi-channel content to engage audiences, raise awareness, and generate demand\\n\\n* Ability to juggle multiple workstreams, repurpose content for different channels, and meet deadlines\\n\\n* Passion for digesting complex and/or technical concepts and making them understandable, relatable, and fascinating\\n\\n* Experience using design thinking and key performance indicators\xa0\\n\\n* Comfortable explaining your work and excited to participate in constructive critiques. You always manage to find the better way to turn a phrase.\xa0\\n\\n* Advanced understanding of SEO and content optimization\\n\\n* Proactive, clear, and thoughtful in your communication with team members and stakeholders\\n\\n* Your writing doesn’t feel like marketing collateral\\n\\n\\n\\n\\n\\nPreferred\xa0\\n\\n* Experience in designing data and complex concepts into concise visualizations\\n\\n* Proficiency in design tools (Sketch, Figma, Photoshop, Illustrator, or similar)\\n\\n* Proficiency in CMS (Sanity) and marketing automation (Hubspot) tools\\n\\n\\n\\n\\n\xa0\\n\\nLocation Note: We are open to fully remote employees who live in our approved states: California, New York, New Jersey, Illinois, and Texas. \\n\\n#Salary and compensation\\n\nNo salary data published by company so we estimated salary based on similar jobs related to Customer Support, Executive, Developer and Digital Nomad jobs that are similar:\\n\\n\n$60,000 — $110,000/year\\n\n\\n\\n#Location\\nSan Francisco, California, United States\n\n\n\n\nSee more jobs at Zeplin""]","['customer support', 'exec', 'dev']",https://remoteok.com,REMOTEOK
Director Strategic Alliances,Mantra Health,💰 $65k - $100k*,Boston,2022-02-12T12:45:07+00:00,https://remoteok.com/remote-jobs/108942-remote-director-strategic-alliances-mantra-health,"[""Mantra Health is hiring a Remote Director Strategic Alliances \n\\nWe are searching for a Director Strategic Alliances to join our growing Sales team. The ideal candidate will have a thorough understanding of the Higher Education market and experience building affiliate/channel partnerships. You’ll work in tandem with Sales and Marketing to establish and manage new lead generation partnerships, which will ultimately broaden Mantra Health’s ability to enable universities to transform the way they provide mental health services.\\n\\n\xa0\\nAbout the Role\\n\\nThe Director Strategic Alliances will:\\n\\n\\n* Report to the VP Sales\\n\\n* Lead, negotiate, and sign channel partners to help sell Mantra Health’s solution to universities\\n\\n* Manage current partnerships, including the National Association of Intercollegiate Athletics (NAIA) & the Consortium of Universities of the Washington Metropolitan Area\\n\\n* Gather a deep understanding of Mantra Health’s mission to find outside-of-the-box partners (consortia, mental health non-profits, associations, buying groups)\\n\\n* Manage a pipeline of potential partners to sign on a quarterly basis\\n\\n* Act as point of contact for all partnership prospects\\n\\n* Work with Sales and Marketing to create a system to funnel leads from partnerships back to Mantra Health’s Sales funnel\\n\\n* Identify thought leaders within the industry to partner with to promote Mantra Health\\n\\n\\n\\n\\n\xa0\\nAbout You\\n\\n\\n* 5+ years in Higher Ed sales or marketing at the national level\\n\\n* Several years’ experience building and managing strategic partnerships/alliances\\n\\n* Deep network of contacts within consortia that sell to Higher Education\\n\\n* Experience developing and advancing external relations and/or strategic partnerships in sales\\n\\n* Work cross-functionally w/ partners on finance and product\\n\\n* Affinity for the mental health field and solving an important societal issue\\n\\n\\n\\nAbout Us\\n\\nMantra Health is a digital mental health clinic on a mission to improve young peoples' mental healthcare access through clinical services, software, and design. Since our founding in 2018, we've built a comprehensive treatment service for young adults with various mental health conditions. We've raised over $27 million to work with students at universities and colleges across the country such as MIT, Cornell, and the University of Minnesota. Our students see clinically significant differences in their mental health during treatment with us. We're particularly proud that nearly two-thirds of students with access to Mantra report that Mantra's program helped them stay in school.\\nOur Benefits\\n\\nAt Mantra, our distributed team is our secret sauce that allows us to support our mission everyday. We're collaborative, empathetic, and curious. We take time to celebrate our wins and learn from our mistakes. Each full-time employee at Mantra enjoys:\\n\\n\\n* 15% Salary + bonus\\n\\n* Equity\\n\\n* Medical, vision, and dental coverage for employees, spouses, and dependents\\n\\n* Flexible work location (work from the Bahamas for a few weeks? Cool by us)\\n\\n* Unlimited PTO\\n\\n* Commuter card, if you commute\\n\\n* Access to One Medical\\n\\n\\n\\n\\n\xa0\\n\\nThe salary range for this role is $140,000 - $150,000 plus bonus & equity\\n\\n\xa0\\n\\nMantra health is an equal opportunity employer. We do not discriminate on the basis of race, religion, color, national origin, gender, sexual orientation, age, marital status, veteran status, or disability status. \\n\\n#Salary and compensation\\n\nNo salary data published by company so we estimated salary based on similar jobs related to Customer Support and Executive jobs that are similar:\\n\\n\n$55,000 — $85,000/year\\n\n\\n\\n#Location\\nNew York City, New York, United States\n\n\n\n\nSee more jobs at Mantra Health""]","['customer support', 'exec']",https://remoteok.com,REMOTEOK
Onboarding Customer Success Manager,Telnyx,💰 $65k - $100k*,Boston,2022-02-12T12:45:06+00:00,https://remoteok.com/remote-jobs/108941-remote-onboarding-customer-success-manager-telnyx,"[""Telnyx \n\n\nApply now\n\n\n👀 525 views\n\n\n✅ 43 applied\n(8%)\n\n\n\nShare this job:\n\n\n\nGet a rok.co short link\n\n\n\nTelnyx is hiring a Remote Onboarding Customer Success Manager \n\\nThe Role:\\n\\nAs an Onboarding Customer Success Manager, you will hold an essential position for the success of new Telnyx customers. Your success lies in getting our customers up and running as fast as possible. You will be responsible for onboarding, ramping and maintaining revenue for Telnyx's largest enterprise customers.\\n\\nYou will work as part of a diverse team of sales executives, customer success professionals, engineers, and product managers to onboard customers onto the Telnyx platform. You’ll build and maintain strong relationships, consistently remain available and responsive, and proactively assess, clarify, and validate customer needs during their onboarding process. The Technical Implementation Manager must be able to sit down with both technical and non technical stakeholders to drive successful execution of their onboarding strategy. You are responsible for ensuring that customer use case and experience are ready to be transitioned to the Customer Success team.\\n\\nThe two key metrics you’ll be evaluated on are the successful onboarding of your book of business and getting customers ramped to their usage commitments.\\n\\nIn This Role You Will:\\n\\n\\nWalk customers through an outlined onboarding process and advise on the best methods to optimize the experience on the Telnyx platform.\\n\\nDevelop implementation plans for some of our largest / most complex customers, including key milestones and metrics for success.\\n\\nDevelop strong relationships with key customer stakeholders across both business and technical roles.\\n\\nTrack daily, weekly, and monthly metrics and reports to support the customer experience.\\n\\nRemain available and responsive to maximize customer satisfaction by addressing inquiries, technical demands, and following through on specified timelines.\\n\\nLead solution development efforts that best address customer needs, while coordinating the involvement of all necessary parties.\\n\\n\\n\\n\\nYou May Be A Fit For This Role If You Have:\\n\\n\\n2-3+ years of customer service of a highly technical product and project management experience in a professional setting (telecommunications background will be a plus).\\n\\nExperience onboarding large Enterprise & Mid-Market customers through complex technical installations spanning many teams and departments.\xa0\\n\\nResourcefulness. Technically competent and enjoy solving problems for our customers and our team\\n\\nAdvanced organizational and time management skills.\\n\\nExcellent project management, developing workflows to increase troubleshooting efficiency while still following standard processes.\\n\\nImpeccable written and verbal communication skills. You are a strong listener and communicator, being able to stand in our customer’s shoes.\\n\\nAnalytical thinking - analyze, synthesize, and apply information to solve problems swiftly while weighing all pros and cons and understanding the downstream effects of decisions.\\n\\nLiving with integrity, transparency, and erring on the side of the action.\\n\\nAdaptive and introspective; ability to work under pressure and help others.\\n\\n\\n\\n\\n\xa0\\n\\nWhat It Is Like To Work At Telnyx:\xa0\\n\\nTelnyx is a complex machine with a simple purpose: connect people. We are an intelligent telephony engine, the beating heart of the Telnyx service that routes data along the pathways of our global, private network. We are drop-in APIs for hooking applications into our products, and an administrator portal that puts unprecedented control of configuring and orchestrating the Telnyx service into our customers’ hands.\\n\\nWe’re also an organization of industry experts and engineers focused on solving problems and building solutions. We’re a concierge customer success team and a 24/7 support team. We’re a communications partner, focused on agile and endless innovation, not a telecom slogged in antiquated processes and anti-competitive regulation. We keep the conversation going: the always-on, omnichannel, enriched conversation that the modern world demands.\\n\\nCommunications are coming untethered from devices, and more and more, they’re migrating into our everyday platforms: our social media, our work applications and our collaboration tools. But, that move started before there was infrastructure to support it—the modern internet will never offer the speed and consistency that real-time communications require. So, we built a network that does and a cloud platform tuned for real-time communications at every layer. Telnyx is the connective matrix, a worldwide nervous system, a high-speed rail tunneling through the information superhighway. We’re the foundation for calls, texts and messaging today, for the internet of things, augmented reality and “communitainment” tomorrow, and for whatever enterprising imaginations can dream up after that.\\n\\nWe’re Telnyx. We’re the future of communications.\\n\\nAt Telnyx, we're looking for people with passion, grit, and integrity. You're encouraged to apply even if your experience doesn't precisely match the job description. Your skills and passion will stand out—and set you apart—especially if your career has taken some extraordinary twists and turns. At Telnyx, we welcome diverse perspectives and people who think rigorously and aren't afraid to challenge assumptions. Join us.\\n\\n#LI-RH1\\n\\n\xa0 \\n\\n#Salary and compensation\\n\nNo salary data published by company so we estimated salary based on similar jobs related to Customer Support and Executive jobs that are similar:\\n\\n\n$55,000 — $85,000/year\\n\n\\n\\n#Location\\nChicago, Illinois, United States\n\n\n\n\nSee more jobs at Telnyx""]","['customer support', 'exec']",https://remoteok.com,REMOTEOK
