Senior Web App Designer,Toptal,💰 $50k - $300k,🌏 Worldwide,2022-02-11T00:00:03+00:00,https://remoteok.com/remote-jobs/108572-remote-senior-web-app-designer-toptal,"[""Toptal \n\n\n\ntoptal.com \n\n\nApply now\n\n\n👀 3,092 views\n\n\n✅ 48 applied\n(2%)\n\n\n\nShare this job:\n\n\n\n\n\n\n\nToptal is also hiring a:\n\n\n\nSenior Front End Developer \nSenior Full Stack Developer \nSenior React Developer \nDigital Product Designer \nSenior React Native Developer  \n\n\nToptal is hiring a Remote Senior Web App Designer \n### Design your lifestyle with the freedom to work however, wherever — on your terms.\\n\\nFreelance work is defining the careers of today's designers in exciting new ways. If you're passionate about working flexibly with leading Fortune 500 brands and innovative Silicon Valley startups, Toptal could be a great fit for your next career move.\xa0\\n\\nToptal is an elite talent network for the world's top 3% of Designers, connecting the best and brightest freelancers with top organizations. Unlike a 9-to-5 job, you'll choose your own schedule and work from anywhere.\xa0**Jobs come to you, so you won't bid for projects against other designers in a race to the bottom.**\xa0Plus, Toptal takes care of all the overhead, empowering you to focus on successful engagements while getting paid on time, at the rate you decide, every time.\xa0\\n\\nAs a freelance designer, you'll instantly join a thriving community of experts in over 120 countries. Work remotely on projects that meet your career ambitions, and expand your impact through networking events, volunteering, publishing, public speaking opportunities, and more.\\n\\nThat's why the world's top 3% of designers choose Toptal. Web App Designers in our network share:\\n* At least 3 years of professional experience as a Web App Designer\\n* Project management skills\\n* A keen attention to detail\\n* Full-time availability is a strong advantage\\n\\nIf you're ready for a career shift to impactful freelance work, take the next step by clicking apply and filling out the short form: [https://topt.al/JQcDX5](https://topt.al/JQcDX5) \\n\\n#Salary and compensation\\n\n$50,000 — $300,000/year\\n\n\\n\\n#Location\\n🌏 Worldwide\n\n\n\n\nSee more jobs at Toptal\n\n\nVisit Toptal's website""]","['design', 'web app design', 'senior', 'designer']",https://remoteok.com,REMOTEOK
Senior UX Designer,Toptal,💰 $100k - $110k,🇺🇸 US,2022-02-11T00:00:03+00:00,https://remoteok.com/remote-jobs/108571-remote-senior-ux-designer-toptal,"[""Toptal \n\n\n\ntoptal.com \n\n\nApply now\n\n\n👀 3,095 views\n\n\n✅ 41 applied\n(1%)\n\n\n\nShare this job:\n\n\n\n\n\n\n\nToptal is also hiring a:\n\n\n\nSenior Front End Developer \nSenior Full Stack Developer \nSenior React Developer \nDigital Product Designer \nSenior React Native Developer  \n\n\nToptal is hiring a Remote Senior UX Designer \n### Design your lifestyle with the freedom to work however, wherever — on your terms.\\n\\nFreelance work is defining the careers of today's designers in exciting new ways. If you're passionate about working flexibly with leading Fortune 500 brands and innovative Silicon Valley startups, Toptal could be a great fit for your next career move.\xa0\\n\\nToptal is an elite talent network for the world's top 3% of Designers, connecting the best and brightest freelancers with top organizations. Unlike a 9-to-5 job, you'll choose your own schedule and work from anywhere.\xa0**Jobs come to you, so you won't bid for projects against other designers in a race to the bottom.**\xa0Plus, Toptal takes care of all the overhead, empowering you to focus on successful engagements while getting paid on time, at the rate you decide, every time.\xa0\\n\\nAs a freelance designer, you'll instantly join a thriving community of experts in over 120 countries. Work remotely on projects that meet your career ambitions, and expand your impact through networking events, volunteering, publishing, public speaking opportunities, and more.\\n\\nThat's why the world's top 3% of designers choose Toptal. UX Designers in our network share:\\n* At least 3 years of professional experience as a UX Designer\\n* Project management skills\\n* A keen attention to detail\\n* Full-time availability is a strong advantage\\n\\nIf you're ready for a career shift to impactful freelance work, take the next step by clicking apply and filling out the short form: [https://topt.al/33cVJJ](https://topt.al/33cVJJ) \\n \\n\\n#Salary and compensation\\n\n$50,000 — $300,000/year\\n\n\\n\\n#Location\\n🌏 Worldwide\n\n\n\n\nSee more jobs at Toptal\n\n\nVisit Toptal's website""]","['design', 'ux', 'ux', 'senior']",https://remoteok.com,REMOTEOK
Senior Go Developer,Toptal,💰 $70k - $130k,🌏 Worldwide,2022-02-11T00:00:03+00:00,https://remoteok.com/remote-jobs/108570-remote-senior-go-developer-toptal,"[""Toptal \n\n\n\ntoptal.com \n\n\nApply now\n\n\n👀 3,196 views\n\n\n✅ 35 applied\n(1%)\n\n\n\nShare this job:\n\n\n\n\n\n\n\nToptal is also hiring a:\n\n\n\nSenior Front End Developer \nSenior Full Stack Developer \nSenior React Developer \nDigital Product Designer \nSenior React Native Developer  \n\n\nToptal is hiring a Remote Senior Go Developer \n### Design your full-time freelance career as a top freelance developer with Toptal.\\n\\nFreelance work is defining developer careers in exciting new ways. If you’re passionate about finding rapid career growth potential working with leading Fortune 500 brands and innovative Silicon Valley startups, Toptal could be a great fit for your next career shift.\\n\\nToptal is an elite talent network made up of the world’s top 3% of developers, connecting the best and brightest freelancers with top organizations. Unlike a 9-to-5 job, you’ll choose your own schedule and work from anywhere.\xa0**Jobs come to you, so you won’t bid for projects against other developers in a race to the bottom.**\xa0Plus, Toptal takes care of all the overhead, empowering you to focus on successful engagements while getting paid on time, at the rate you decide, every time. Our sophisticated screening process makes sure you are provided with top clients without additional overhead, as well as assistance in maximizing the potential of your full-time freelance career. Joining the Toptal network also gives you access to technical training programs, mentors, and coaching programs, so you can connect with a global community of experts like you to share peer-to-peer knowledge and expand your network globally.\\n\\nAs a freelance developer, you can become a part of an ever-expanding community of experts in over 120 countries, working remotely on projects that meet your career ambitions.\\n\\nThat’s why the world’s top 3% of developers choose Toptal. Developers in our elite network share:\\n* English language proficiency\\n* 3+ years of professional experience\\n* Project management skills\\n* A keen attention to detail\\n* Experience with system architecture or leading a software team is a strong advantage\\n* Full-time availability is a strong advantage\\n\\nCurious to know how much you could make? Check out our Front-End developer rate calculator:\xa0[https://topt.al/zVcbvK](https://topt.al/zVcbvK) \\n\\nIf you’re interested in pursuing an engaging career working on full-time freelance jobs for exclusive clients, take the next step by clicking apply and filling out the short form:\xa0[https://topt.al/A2cgwZ](https://topt.al/A2cgwZ) \\n\\n#Salary and compensation\\n\n$50,000 — $300,000/year\\n\n\\n\\n#Location\\n🌏 Worldwide\n\n\n\n\nSee more jobs at Toptal\n\n\nVisit Toptal's website""]","['front end', 'senior', 'dev', 'go']",https://remoteok.com,REMOTEOK
Senior Ruby On Rails Developer,Toptal,💰 $120k - $160k,"Washington, DC",2022-02-11T00:00:03+00:00,https://remoteok.com/remote-jobs/108569-remote-senior-ruby-on-rails-developer-toptal,"[""Toptal \n\n\n\ntoptal.com \n\n\nApply now\n\n\n👀 3,178 views\n\n\n✅ 33 applied\n(1%)\n\n\n\nShare this job:\n\n\n\n\n\n\n\nToptal is also hiring a:\n\n\n\nSenior Front End Developer \nSenior Full Stack Developer \nSenior React Developer \nDigital Product Designer \nSenior React Native Developer  \n\n\nToptal is hiring a Remote Senior Ruby On Rails Developer \n### Design your full-time freelance career as a top freelance developer with Toptal.\\n\\nFreelance work is defining developer careers in exciting new ways. If you’re passionate about finding rapid career growth potential working with leading Fortune 500 brands and innovative Silicon Valley startups, Toptal could be a great fit for your next career shift.\\n\\nToptal is an elite talent network made up of the world’s top 3% of developers, connecting the best and brightest freelancers with top organizations. Unlike a 9-to-5 job, you’ll choose your own schedule and work from anywhere.\xa0**Jobs come to you, so you won’t bid for projects against other developers in a race to the bottom.**\xa0Plus, Toptal takes care of all the overhead, empowering you to focus on successful engagements while getting paid on time, at the rate you decide, every time. Our sophisticated screening process makes sure you are provided with top clients without additional overhead, as well as assistance in maximizing the potential of your full-time freelance career. Joining the Toptal network also gives you access to technical training programs, mentors, and coaching programs, so you can connect with a global community of experts like you to share peer-to-peer knowledge and expand your network globally.\\n\\nAs a freelance developer, you can become a part of an ever-expanding community of experts in over 120 countries, working remotely on projects that meet your career ambitions.\\n\\nThat’s why the world’s top 3% of developers choose Toptal. Developers in our network share:\\n* English language proficiency\\n* 3+ years of professional experience\\n* Project management skills\\n* A keen attention to detail\\n* Experience with system architecture or leading a software team is a strong advantage\\n* Full-time availability is a strong advantage\\n\\nCurious to know how much you could make? Check out our Back-End developer rate calculator:\xa0[https://topt.al/PbcMQD](https://topt.al/PbcMQD) \\n\\nIf you’re interested in pursuing an engaging career working on full-time freelance jobs for exclusive clients, take the next step by clicking apply and filling out the short form:\xa0[https://topt.al/Z8cM4Q](https://topt.al/Z8cM4Q) \\n\\n#Salary and compensation\\n\n$50,000 — $300,000/year\\n\n\\n\\n#Location\\n🌏 Worldwide\n\n\n\n\nSee more jobs at Toptal\n\n\nVisit Toptal's website""]","['backend', 'senior', 'dev', 'ror']",https://remoteok.com,REMOTEOK
Senior React Native Developer,Toptal,💰 $40k - $150k,"Austin, Texas",2022-02-11T00:00:02+00:00,https://remoteok.com/remote-jobs/108568-remote-senior-react-native-developer-toptal,"[""Toptal \n\n\n\ntoptal.com \n\n\nApply now\n\n\n👀 3,551 views\n\n\n✅ 60 applied\n(2%)\n\n\n\nShare this job:\n\n\n\n\n\n\n\nToptal is also hiring a:\n\n\n\nSenior Front End Developer \nSenior Full Stack Developer \nSenior React Developer \nDigital Product Designer \nSenior Ruby On Rails Developer  \n\n\nToptal is hiring a Remote Senior React Native Developer \n### Design your full-time freelance career as a top freelance developer with Toptal.\\n\\nFreelance work is defining developer careers in exciting new ways. If you’re passionate about finding rapid career growth potential working with leading Fortune 500 brands and innovative Silicon Valley startups, Toptal could be a great fit for your next career shift.\\n\\nToptal is an elite talent network made up of the world’s top 3% of developers, connecting the best and brightest freelancers with top organizations. Unlike a 9-to-5 job, you’ll choose your own schedule and work from anywhere.\xa0**Jobs come to you, so you won’t bid for projects against other developers in a race to the bottom.**\xa0Plus, Toptal takes care of all the overhead, empowering you to focus on successful engagements while getting paid on time, at the rate you decide, every time. Our sophisticated screening process makes sure you are provided with top clients without additional overhead, as well as assistance in maximizing the potential of your full-time freelance career. Joining the Toptal network also gives you access to technical training programs, mentors, and coaching programs, so you can connect with a global community of experts like you to share peer-to-peer knowledge and expand your network globally.\\n\\nAs a freelance developer, you can become a part of an ever-expanding community of experts in over 120 countries, working remotely on projects that meet your career ambitions.\\n\\nThat’s why the world’s top 3% of developers choose Toptal. Developers in our elite network share:\\n* English language proficiency\\n* 3+ years of professional experience\\n* Project management skills\\n* A keen attention to detail\\n* Experience with system architecture or leading a software team is a strong advantage\\n* Full-time availability is a strong advantage\\n\\nCurious to know how much you could make? Check out our React Native developer rate calculator:\xa0[https://topt.al/avcMnn](https://topt.al/avcMnn) \\n\\nIf you’re interested in pursuing an engaging career working on full-time freelance jobs for exclusive clients, take the next step by clicking apply and filling out the short form:\xa0[https://topt.al/4JcDNG](https://topt.al/4JcDNG) \\n\\n#Salary and compensation\\n\n$50,000 — $300,000/year\\n\n\\n\\n#Location\\n🌏 Worldwide\n\n\n\n\nSee more jobs at Toptal\n\n\nVisit Toptal's website""]","['front end', 'senior', 'dev', 'react native']",https://remoteok.com,REMOTEOK
Full Stack Engineer Ruby on Rails React. JS,LexShares,💰 $65k - $100k*,🇺🇸 US,2022-02-10T00:00:03+00:00,https://remoteok.com/remote-jobs/108547-remote-full-stack-engineer-ruby-on-rails-react-js-lexshares,"[""LexShares \n\n\n\nlexshares.com \n\n\nApply now\n\n\n👀 3,912 views\n\n\n✅ 82 applied\n(2%)\n\n\n\nShare this job:\n\n\n\n\n\n\n\nLexShares is hiring a Remote Full Stack Engineer Ruby on Rails React. JS \nWe’re seeking a full-stack engineer who is ready to work with new technologies and architectures. Here, you will take complete, end-to-end ownership of projects across the entire stack. Our ideal candidate has experience building products across the stack and a firm understanding of web frameworks, APIs, databases, and multiple back-end languages.\\n\\n* Participate in all aspects of agile software development including design, implementation, and deployment\\n* Architect and provide guidance on building end-to-end systems optimized for speed and scale on AWS\\n* Work with and manage freelance contractors as needed to assist in getting projects done\\n* Work primarily in Ruby, React, and JavaScript\\n* Collaborate via Slack, GitHub comments, documents, and frequent video conferences\\n\\n**Skills & Responsibilities**\\n\\n* Minimum of 3 years of development experience working in a fast-paced environment \\n* Knowledge of Ruby, RoR, React, and Javascript.\\n* Solid understanding of object-oriented programming\\n* Solid understanding of database systems such as MySQL and PostgreSQL\\n* Follow best practices (test-driven development, continuous integration, SCRUM, refactoring, and code standards)\\n* Understanding of fundamental design principles behind a scalable application\\n* Experience with cloud hosting solutions such as Heroku and AWS\\n\\n \\n\\nBe sure to mention the word **GAILY** when applying to show you read the job post completely. This is a beta feature to avoid spam applicants. Companies can search these words to find applicants that read this and see they're human.\\n\\n \\n\\n#Salary and compensation\\n\n$100,000 — $110,000/year\\n\n\\n\\n#Location\\nUS Only\n\n\n\n\nSee more jobs at LexShares\n\n\nVisit LexShares's website""]","['ruby', 'ruby on rails', 'react', 'javascript']",https://remoteok.com,REMOTEOK
Senior Blockchain Developer,ReadyTal,💰 $60k - $100k*,New York or Us/eu Timezones,2022-02-10T00:00:02+00:00,https://remoteok.com/remote-jobs/108541-remote-senior-blockchain-developer-readytal,"[""ReadyTal \n\n\n\nreadytal.com  \n\n\nApply now\n\n\n👀 4,040 views\n\n\n✅ 62 applied\n(2%)\n\n\n\nShare this job:\n\n\n\n\n\n\n\nReadyTal is also hiring a:\n\n\n\nSenior Ruby on Rails Developer \nIntermediate and Senior DevOps Engineers  \n\n\nReadyTal is hiring a Remote Senior Blockchain Developer \nReadyTal is seeking highly talented and passionate Blockchain Developers to help a select group of international companies build their teams with the best global remote developer talent.\\n\\nFor a limited time: Apply now and receive a sign up bonus equal to 5% of your annual base salary on us, once you accept your first job offer with ReadyTal or any of the companies on our platform.\\n\\n**Required Skills\\n\\n* High level of proficiency in Typescript/Javascript.\\n* Solid development experience with Rust, C++, Haskell, Java. \xa0\\n* Advanced understanding and experience with AWS tools and technologies. \\n* Hands-on development experience with blockchains, consensus algorithms, and knowledge of cryptographic primitives and standards. \\n* Experience with building and using distributed systems, solid understanding of technical challenges and design patterns applicable in this context. \\n* Experience in building enterprise products and platforms in the Cloud using databases, Linux, messaging queues, web sockets, APIs, and so on. \\n* Prior professional experience in open source environments. - * Ability to quickly grasp complex problems and apply them to work projects. - * Excellent interpersonal and communication skills (both written and oral) in English.\\n* Highly self-motivated and results-oriented team player.\xa0Capacity and independent work ability to research and explore new technologies as well as understand complex code.\\n* Personal/professional integrity and commitment to excellence.\\n* Nice to have:\xa0In-depth knowledge of Cardano, Ethereum and/or Polkadot/substrate\\n* Nice to have:\xa0Experience building enterprise-scale PaaS offerings. \\n\\nBe sure to mention the word **SWIFT** when applying to show you read the job post completely. This is a beta feature to avoid spam applicants. Companies can search these words to find applicants that read this and see they're human.\\n\\n \\n\\n#Salary and compensation\\n\n$70,000 — $130,000/year\\n\n\\n\\n#Location\\n🌏 Worldwide\n\n\n\n\nSee more jobs at ReadyTal\n\n\nVisit ReadyTal's website""]","['blockchain', 'rust', 'haskell', 'typescript']",https://remoteok.com,REMOTEOK
Data Analytics Manager,Doximity,💰 $65k - $100k*,"San Francisco, CA",2022-02-09T16:10:20+00:00,https://remoteok.com/remote-jobs/107099-remote-data-analytics-manager-doximity,"[""Doximity \n\n\n\ndoximity.com \n\n\nApply now\n\n\n👀 6,534 views\n\n\n✅ 1,244 applied\n(19%)\n\n\n\nShare this job:\n\n\n\nGet a rok.co short link\n\n\n\nDoximity is also hiring a:\n\n\n\nSite Reliability Engineer  \n\n\nDoximity is hiring a Remote Data Analytics Manager \nDoximity is transforming the healthcare industry. Our mission is to help doctors be more productive, informed, and connected. As a Data Analyst, you'll work within cross-functional delivery teams alongside other analysts, engineers, and product managers in discovering data insights to help improve healthcare.\\n\\nOur team brings a diverse set of technical and cultural backgrounds and we like to think pragmatically in choosing the tools most appropriate for the job at hand.\\n\\n**About Us**\\n\\n* Here are some of the ways we [bring value to doctors](https://drive.google.com/file/d/1qimYh0mG3i1nTJe6jDCDepJt2i4o8MEB/view)\\n * Here is an introduction to [our tech stack](https://technology.doximity.com/technology-stack)\\n* We use UNIX command-line interface and standard programming tools (vim/emacs, git, etc.) and have over 350 private repositories in Github containing our applications, forks of gems, our own internal gems, and open-source projects\\n* We have worked as a distributed team for a long time; we're currently about [65% distributed](https://brunomiranda.com/blog/building-a-distributed-engineering-team/)\\n* Find out more information on the [Doximity engineering blog](https://technology.doximity.com/)\\n* Our [company core values](https://work.doximity.com/)\\n* Our [recruiting process](https://technology.doximity.com/articles/engineering-recruitment-process-doximity)\\n* Our [product development cycle](https://technology.doximity.com/articles/mofo-driven-product-development)\\n* Our [on-boarding & mentorship process](https://technology.doximity.com/articles/software-engineering-on-boarding-at-doximity)\\n\\n**Here's How You Will Make an Impact**\\n\\n* Leverage Doximity's extensive datasets to identify and classify behavioral patterns of medical professionals on our platform.\\n* Play a key role in creating both product and client-facing analytics.\\n* Inform data team strategy by working with the product leaders and managers. Actively participate in execution and some planning of organizational data team strategy.\xa0\\n* Collaborate with a team of product managers, analysts, and other developers to define and lead data projects from data ingestion to analysis to recommendations.\\n\\n**About you**\\n\\n* At least 4 years of industry experience as a data analyst or a data scientist.\\n* Experience managing 4 or more direct reports.\\n* Ability to balance individual contribution on projects from start to finish, along with managing individuals.\\n* Excellent SQL skills to create and evaluate complex statements involving numerous tables and data relationships.\\n* Experience with Python and understanding of the object-oriented programming concepts and testing as it relates to data and Python.\\n* Prior exposure to distributed data processing concepts and execution (e.g., working with column stores, leveraging Spark, etc.)\\n* Expert knowledge of probability and statistics (e.g., experimental design, optimization, predictive modeling).\\n* B.S./M.S. in Computer Science, Engineering, Statistics, or other relevant technical field is a plus but not required.\\n* This role is not eligible for immigration sponsorship.\\n* This role can be filled in our San Francisco headquarters OR remotely in the U.S.\\n\\n**Benefits**\\n\\nDoximity has industry-leading benefits. For an updated list, see our career page\\n\\n**More info on Doximity**\\n\\nJoining Doximity means being part of an incredibly talented and humble team. We work on amazing products that over 80% of US doctors (and over one million healthcare professionals) use to make their busy lives a little easier. We’re driven by the goal of improving inefficiencies in our $3.5 trillion U.S. healthcare system and love creating technology that has a real, meaningful impact on people’s lives. To learn more about our team, culture, and users, check out our careers page, company blog, and engineering blog. We’re growing steadily, and there’s plenty of opportunities for you to make an impact.\\n\\n*Doximity is proud to be an equal opportunity employer and committed to providing employment opportunities regardless of race, religious creed, color, national origin, ancestry, physical disability, mental disability, medical condition, genetic information, marital status, sex, gender, gender identity, gender expression, pregnancy, childbirth and breastfeeding, age, sexual orientation, military or veteran status, or any other protected classification. We also consider qualified applicants with criminal histories, consistent with applicable federal, state, and local law.* \\n\\nBe sure to mention the word **COMPLIANT** when applying to show you read the job post completely. This is a beta feature to avoid spam applicants. Companies can search these words to find applicants that read this and see they're human.\\n\\n \\n\\n#Salary and compensation\\n\n$120,000 — $160,000/year\\n\n\\n\\n#Location\\n🇺🇸 US\n\n\n\n\nSee more jobs at Doximity\n\n\nVisit Doximity's website""]","['other', 'data analytics', 'sql', 'python']",https://remoteok.com,REMOTEOK
